i2c-1: Start
i2c-1: 0
i2c-1: 1
i2c-1: 0
i2c-1: 0
i2c-1: 1
i2c-1: 0
i2c-1: 0
i2c-1: 0
i2c-1: Write
i2c-1: Address write: 09
i2c-1: ACK
i2c-1: Stop
i2c-1: Start
i2c-1: 1
i2c-1: 1
i2c-1: 0
i2c-1: 0
i2c-1: 1
i2c-1: 1
i2c-1: 0
i2c-1: 0
i2c-1: Read
i2c-1: Address read: 19
i2c-1: ACK
i2c-1: Stop
i2c-1: Start
i2c-1: 0
i2c-1: 1
i2c-1: 0
i2c-1: 0
i2c-1: 0
i2c-1: 0
i2c-1: 1
i2c-1: 0
i2c-1: Write
i2c-1: Address write: 21
i2c-1: NACK
i2c-1: Stop
i2c-1: Start
i2c-1: 1
i2c-1: 0
i2c-1: 0
i2c-1: 1
i2c-1: 0
i2c-1: 0
i2c-1: 1
i2c-1: 0
i2c-1: Read
i2c-1: Address read: 24
i2c-1: ACK
i2c-1: Stop
i2c-1: Start
i2c-1: 0
i2c-1: 1
i2c-1: 0
i2c-1: 1
i2c-1: 0
i2c-1: 1
i2c-1: 0
i2c-1: 1
i2c-1: Write
i2c-1: Address write: 55
i2c-1: ACK
i2c-1: Start repeat
i2c-1: 1
i2c-1: 1
i2c-1: 0
i2c-1: 0
i2c-1: 0
i2c-1: 1
i2c-1: 0
i2c-1: 0
i2c-1: Read
i2c-1: Address read: 11
i2c-1: ACK
i2c-1: Stop
i2c-1: Start
i2c-1: 0
i2c-1: 0
i2c-1: 1
i2c-1: 0
i2c-1: 1
i2c-1: 0
i2c-1: 0
i2c-1: 0
i2c-1: Write
i2c-1: Address write: 0A
i2c-1: NACK
i2c-1: Stop
i2c-1: Start
i2c-1: 0
i2c-1: 1
i2c-1: 0
i2c-1: 0
i2c-1: 0
i2c-1: 0
i2c-1: 0
i2c-1: 0
i2c-1: Write
i2c-1: Address write: 01
i2c-1: ACK
i2c-1: Stop
i2c-1: Start
